title,link,organization,rating,skills,difficulty,duration
Microsoft SQL Server,https://www.coursera.org/professional-certificates/microsoft-sql-server,Microsoft,4.4,"Stored Procedure, Database Design, Data Warehousing, Star Schema, Microsoft SQL Servers, Relational Databases, SQL, Transaction Processing, Database Management, Transact-SQL, Databases, Database Management Systems, Query Languages, Performance Tuning, Database Architecture and Administration, Data Modeling, Operational Databases, Database Systems, Data Manipulation, Data Management",Beginner,3 - 6 Months
Oracle SQL Databases,https://www.coursera.org/specializations/oracle-sql-databases,LearnQuest,4.6,"Oracle SQL Developer, SQL, Oracle Databases, PL/SQL, Database Design, Database Theory, Database Management Systems, Database Administration, Relational Databases, Database Management, Databases, Database Software, Database Architecture and Administration, Data Storage, Transaction Processing, Stored Procedure, Data Access, Data Modeling, Network Architecture, Data Integrity",Beginner,3 - 6 Months
SQL: A Practical Introduction for Querying Databases,https://www.coursera.org/learn/sql-practical-introduction-for-querying-databases,IBM,4.7,"SQL, Relational Databases, Microsoft SQL Servers, MySQL, Query Languages, Database Systems, Databases, Database Management, Stored Procedure, IBM DB2, Data Manipulation, Data Analysis, Transaction Processing",Beginner,1 - 3 Months
Learn SQL Basics for Data Science,https://www.coursera.org/specializations/learn-sql-basics-data-science,"University of California, Davis",4.6,"Data Governance, Presentations, SQL, Apache Spark, Distributed Computing, Descriptive Statistics, Data Lakes, Data Storytelling, Peer Review, Exploratory Data Analysis, Data Quality, Data Pipelines, Databricks, JSON, Statistical Analysis, Data Modeling, Database Design, Data Analysis, Complex Problem Solving, Data Visualization",Beginner,3 - 6 Months
SQL Foundations,https://www.coursera.org/learn/sql-foundations,Microsoft,4.4,"Microsoft SQL Servers, SQL, Transact-SQL, Databases, Database Management Systems, Relational Databases, Data Transformation, Data Manipulation, Data Access, Query Languages, Generative AI, Data Presentation",Beginner,1 - 4 Weeks
Master SQL for Data Analysis,https://www.coursera.org/learn/packt-master-sql-for-data-analysis-creek,Packt,,,Intermediate,3 - 6 Months
Introduction to Structured Query Language (SQL),https://www.coursera.org/learn/intro-sql,University of Michigan,4.8,"Database Design, SQL, MySQL, Relational Databases, Databases, Data Modeling, Development Environment, PHP (Scripting Language), Software Installation",Intermediate,1 - 4 Weeks
SQL for Data Science,https://www.coursera.org/learn/sql-for-data-science,"University of California, Davis",4.6,"Data Governance, SQL, Data Quality, Database Design, Query Languages, Data Manipulation, Data Modeling, Relational Databases, Data Science, Data Analysis, Data Cleansing",Beginner,1 - 4 Weeks
The Structured Query Language (SQL),https://www.coursera.org/learn/the-structured-query-language-sql,University of Colorado Boulder,4.7,"SQL, Database Management, Query Languages, Relational Databases, Database Design, Database Theory, Database Administration, Data Analysis, Database Application, Data Access, Data Manipulation, Data Science, Data Modeling",Beginner,1 - 3 Months
Intro to SQL,https://www.coursera.org/learn/intro-to-sql,Scrimba,4.4,"SQL, Data Manipulation, Query Languages, Database Management, Relational Databases, Stored Procedure, Data Synthesis, IT Automation, Scripting, Database Management Systems, Data Access",Beginner,1 - 4 Weeks
IBM Data Engineering,https://www.coursera.org/professional-certificates/ibm-data-engineer,IBM,4.6,"NoSQL, Data Warehousing, SQL, Apache Hadoop, Extract, Transform, Load, Apache Airflow, Web Scraping, Linux Commands, Database Design, IBM Cognos Analytics, MySQL, Apache Spark, Database Administration, Data Store, Jupyter, Generative AI, Professional Networking, Python Programming, Data Analysis, Data Science",Beginner,3 - 6 Months
Project Management,https://www.coursera.org/specializations/meem-project-management,University of Colorado Boulder,4.7,"User Story, Supplier Management, Project Schedules, Project Closure, Engineering Management, Milestones (Project Management), Team Leadership, Stakeholder Management, Scheduling, Agile Project Management, Scrum (Software Development), Procurement, Quality Management, Team Management, Project Planning, Agile Methodology, Project Scoping, Project Management, Risk Management, Stakeholder Communications",Beginner,1 - 3 Months
Project Management Principles and Practices,https://www.coursera.org/specializations/project-management,"University of California, Irvine",4.7,"Cost Estimation, Stakeholder Management, Project Risk Management, Project Controls, Project Schedules, Work Breakdown Structure, Project Performance, Estimation, Conflict Management, Quality Management, Change Control, Project Management, Timelines, Milestones (Project Management), Peer Review, Project Planning, Budgeting, Scheduling, Project Management Life Cycle, Risk Management",Beginner,3 - 6 Months
Project Management,https://www.coursera.org/specializations/uci-project-management,"University of California, Irvine",4.7,"Project Schedules, Project Planning, Stakeholder Management, Communication Planning, Project Implementation, Earned Value Management, Agile Methodology, Agile Project Management, Stakeholder Communications, Project Scoping, Work Breakdown Structure, Project Management, Program Management, Conflict Management, Project Coordination, Milestones (Project Management), Resource Utilization, Resource Planning, Project Documentation, Leadership",Beginner,3 - 6 Months
Microsoft Project Management,https://www.coursera.org/professional-certificates/microsoft-project-management,Microsoft,4.7,"Stakeholder Management, Virtual Teams, Scheduling, Team Management, Conflict Management, Project Schedules, Project Management Life Cycle, Project Management Office (PMO), Excel Formulas, Procurement, Project Coordination, Kanban Principles, Performance Measurement, Strategic Communication, Leadership, Risk Management, Communication, Planning, Project Management, Budgeting",Beginner,3 - 6 Months
Engineering Project Management,https://www.coursera.org/specializations/engineering-project-management,Rice University,4.7,"Project Scoping, Communication Planning, Cost Management, Scope Management, Project Estimation, Project Schedules, Earned Value Management, Scheduling, Team Management, Quality Assurance, Stakeholder Management, Work Breakdown Structure, Risk Management, Organizational Structure, Procurement, Project Risk Management, Project Documentation, Requirements Management, Project Management, Planning",Beginner,3 - 6 Months
Foundations of Project Management,https://www.coursera.org/learn/project-management-foundations,Google,4.9,"Project Management Life Cycle, Change Management, Organizational Structure, Project Management, Organizational Change, Program Management, Project Closure, Agile Methodology, Project Planning, Waterfall Methodology, Strategic Thinking",Beginner,1 - 4 Weeks
Project Management and Planning,https://www.coursera.org/specializations/project-management-and-planning,Johns Hopkins University,4.7,"Project Closure, Work Breakdown Structure, Earned Value Management, Configuration Management, Project Portfolio Management, Negotiation, Project Management Life Cycle, Project Management, Project Schedules, Agile Methodology, Project Controls, Product Roadmaps, Scheduling, Conflict Management, Agile Project Management, Project Coordination, Risk Management, Project Planning, Team Leadership, Stakeholder Engagement",Intermediate,3 - 6 Months
Project Management in Construction,https://www.coursera.org/specializations/project-management-in-construction,L&T EduTech,4.7,"Scope Management, Stakeholder Management, Project Schedules, Project Risk Management, Environment Health And Safety, Work Breakdown Structure, Project Scoping, Earned Value Management, Feasibility Studies, Risk Analysis, Quality Management, Procurement, Cost Estimation, Scheduling, Cost Management, Project Management Life Cycle, Contract Management, Communication Strategies, Risk Management, Project Controls",Advanced,1 - 3 Months
Introduction to Agile Development and Scrum,https://www.coursera.org/learn/agile-development-and-scrum,IBM,4.9,"User Story, Agile Software Development, Scrum (Software Development), Agile Methodology, Kanban Principles, Backlogs, Sprint Retrospectives, Agile Project Management, Workflow Management, Sprint Planning, Team Management, Product Requirements, Lean Methodologies, Performance Measurement",Beginner,1 - 4 Weeks
Project Management Essentials,https://www.coursera.org/learn/copy-of-project-management-essentials,Howard University,4.6,"Project Management Life Cycle, Project Management Institute (PMI) Methodology, Project Management, Project Coordination, Agile Project Management, Project Risk Management, Scope Management, Project Controls, Project Planning, Project Closure, Stakeholder Management, Change Control, Leadership",Beginner,1 - 4 Weeks
Construction Management,https://www.coursera.org/specializations/construction-management,Columbia University,4.7,"Project Schedules, Construction Management, Construction Estimating, Project Finance, Cost Estimation, Punch Work, Project Risk Management, Bidding, Building Information Modeling, Scheduling, Cost Control, Environment Health And Safety, Project Closure, Lean Methodologies, Timelines, Real Estate, Finance, Construction, Business Transformation, Innovation",Beginner,3 - 6 Months
IBM Project Manager,https://www.coursera.org/professional-certificates/ibm-project-manager,IBM,4.8,"User Story, Stakeholder Engagement, Project Management Life Cycle, Resource Management, Risk Management, Peer Review, Agile Software Development, Scrum (Software Development), Earned Value Management, Stakeholder Management, Agile Methodology, Project Risk Management, Kanban Principles, Team Motivation, Project Management, IT Management, Interviewing Skills, Professional Networking, Leadership, Communication",Beginner,3 - 6 Months
Power BI: Data Modeling and Data Analysis,https://www.coursera.org/learn/power-bi-data-modeling-and-data-analysis,Whizlabs,,"Power BI, Data Analysis Expressions (DAX), Data Modeling, Star Schema, Data Warehousing, Data Security, Data Visualization Software, Pivot Tables And Charts, Performance Tuning, Business Intelligence, Excel Formulas, Role-Based Access Control (RBAC)",Intermediate,1 - 4 Weeks
Microsoft Power BI and Power Platform for Productivity,https://www.coursera.org/specializations/microsoft-power-bi-and-power-platform-productivity,Microsoft,4.5,"Extract, Transform, Load, Star Schema, Microsoft Power Platform, Data Analysis Expressions (DAX), Data Storytelling, Microsoft Power Automate/Flow, Dashboard, Microsoft Excel, Excel Formulas, Power BI, Data-Driven Decision-Making, Microsoft Copilot, Data Presentation, Spreadsheet Software, Data Transformation, Data Literacy, Data Modeling, Data Visualization, Data Analysis, Business Intelligence",Beginner,3 - 6 Months
BI Essentials for Finance Analysts (Power BI Edition),https://www.coursera.org/specializations/bi-essentials-for-finance-professionals-powerbi,Corporate Finance Institute,4.8,"Data Analysis Expressions (DAX), Power BI, Snowflake Schema, Data Modeling, SQL, Dashboard, Microsoft Excel, Business Intelligence, Excel Formulas, Pivot Tables And Charts, Data Import/Export, Business Reporting, Databases, Interactive Data Visualization, Data Storytelling, Financial Statements, Data Manipulation, Data Transformation, Financial Analysis, Data Visualization",Beginner,3 - 6 Months
Power BI Fundamentals,https://www.coursera.org/learn/power-bi-fundamentals,Corporate Finance Institute,4.9,"Power BI, Data Analysis Expressions (DAX), Dashboard, Business Intelligence, Data Import/Export, Business Reporting, Interactive Data Visualization, Data Storytelling, Data Modeling, Data Transformation, Data Visualization Software, Data Analysis, Data Sharing, Sales, Key Performance Indicators (KPIs)",Beginner,1 - 3 Months
Exam Prep PL-300: Microsoft Power BI Data Analyst Associate,https://www.coursera.org/specializations/exam-prep-pl-300-microsoft-power-bi-data-analyst-associate,Whizlabs,,"Power BI, Dashboard, Business Intelligence, Data Presentation, Data Storytelling, Data Visualization Software, Data Transformation, Data Analysis Expressions (DAX), Business Analytics, Data Modeling, Star Schema, Data-Driven Decision-Making, Pivot Tables And Charts, Key Performance Indicators (KPIs), Interactive Data Visualization, Microsoft Power Platform, Microsoft Excel, Data Management, Data Analysis, Advanced Analytics",Intermediate,1 - 3 Months
Microsoft Copilot for Power BI: AI-Powered Report Insights,https://www.coursera.org/learn/microsoft-copilot-for-power-bi-ai-powered-report-insights,Coursera Instructor Network,,"Data Analysis Expressions (DAX), Power BI, Dashboard, Data Modeling, Business Intelligence, Microsoft Excel, Data Visualization Software, Microsoft Copilot, Data Integration, Interactive Data Visualization, Data-Driven Decision-Making, Data Manipulation, Data Transformation, Data Cleansing, ChatGPT",Intermediate,1 - 4 Weeks
Power BI: Data Visualization and Analysis,https://www.coursera.org/learn/power-bi-data-visualization-essentials,Whizlabs,,"Business Intelligence, Data Presentation, Data Storytelling, Interactive Data Visualization, Data Visualization Software, Business Analytics, Power BI, Pivot Tables And Charts, Dashboard, Key Performance Indicators (KPIs), Performance Reporting, Data Analysis, Scatter Plots, Business Reporting, Trend Analysis, Time Series Analysis and Forecasting",Intermediate,1 - 4 Weeks
Exam Prep PL-400: Microsoft Power Platform Developer Assoc.,https://www.coursera.org/specializations/exam-prep-pl-400-microsoft-certified-power-platform-developer-associate,Whizlabs,,"Microsoft Power Automate/Flow, Microsoft Power Platform, Data Analysis Expressions (DAX), Power BI, Microsoft Azure, Dashboard, Workflow Management, Process Analysis, Microsoft Copilot, Robotic Process Automation, Business Process Automation, Microsoft 365, Process Optimization, Automation, Data Integration, Cloud-Based Integration, Microsoft Visual Studio, Restful API, Application Lifecycle Management, JSON",Intermediate,1 - 3 Months
Master Microsoft Office 365 and Power Platform,https://www.coursera.org/specializations/master-microsoft-office-365-power-platform,Microsoft,4.7,"Microsoft Power Platform, Microsoft Copilot, Prompt Engineering, Microsoft Power Automate/Flow, Power BI, Microsoft 365, Multimedia, Microsoft PowerPoint, Dashboard, Microsoft Excel, Excel Formulas, Microsoft Word, Data Visualization, Spreadsheet Software, Microsoft Outlook, Data Integration, Productivity Software, Business Intelligence, Presentations, Data Analysis",Beginner,3 - 6 Months
Mastering Power BI for Data Analytics & Storytelling,https://www.coursera.org/specializations/mastering-power-bi-data-analytics-storytelling,Edureka,4.3,"Power BI, Snowflake Schema, Data Analysis Expressions (DAX), Data Modeling, Microsoft SQL Servers, AWS Identity and Access Management (IAM), Inventory Management System, Transact-SQL, Amazon Web Services, SQL, Data Visualization Software, Interactive Data Visualization, Dashboard, Data Storytelling, Database Design, Data Analysis, Data Presentation, Data Transformation, Analytical Skills, Business Intelligence",Intermediate,3 - 6 Months
Microsoft Power Platform Fundamentals PL-900 Exam Prep,https://www.coursera.org/specializations/microsoft-power-platform-fundamentals,Microsoft,4.4,"Microsoft Power Platform, Microsoft Power Automate/Flow, Power BI, Dashboard, Data Visualization, Business Intelligence, Business Process Automation, Productivity Software, Application Development, Data Integration, Performance Analysis, Automation, Data Security, Workflow Management, Cloud Applications, Data Analysis Software, Business Process, Generative AI Agents, Microsoft Teams, Data Modeling",Beginner,1 - 3 Months
Data Analysis and Visualization with Power BI,https://www.coursera.org/learn/data-analysis-and-visualization-with-power-bi,Microsoft,4.7,"Dashboard, Power BI, Data Storytelling, Data Visualization Software, Data Visualization, Data Presentation, Advanced Analytics, Statistical Reporting, Interactive Data Visualization, Business Intelligence, Data Analysis, Web Content Accessibility Guidelines",Beginner,1 - 3 Months
Digital Marketing,https://www.coursera.org/specializations/digital-marketing,University of Illinois Urbana-Champaign,4.7,"Data Storytelling, Marketing Analytics, Keyword Research, Email Marketing, Cross-Channel Marketing, Marketing Planning, Strategic Communication, Content Marketing, Digital Marketing, Google Analytics, Marketing Communications, Analytics, Marketing Channel, Digital Media Strategy, Online Advertising, Marketing, Web Analytics, Marketing Strategies, Data Analysis, Data Visualization",Beginner,3 - 6 Months
Generative AI in Marketing,https://www.coursera.org/specializations/generative-ai-in-marketing,University of Virginia Darden School Foundation,4.3,"Large Language Modeling, Customer Insights, ChatGPT, Branding, Design Thinking, Keyword Research, Search Engine Marketing, Pay Per Click Advertising, Brand Awareness, Brand Strategy, Digital Marketing, Marketing Design, Generative AI, Marketing Strategy and Techniques, Business Marketing, Personalized Service, Prompt Engineering, Customer Relationship Management, AI Personalization, Machine Learning",Beginner,1 - 3 Months
Marketing Strategy,https://www.coursera.org/specializations/marketing-strategy,IE Business School,4.5,"Survey Creation, Surveys, Marketing Planning, Market Research, Business Research, Product Marketing, Consumer Behaviour, Value Propositions, Market Analysis, Marketing, Business Planning, Marketing Channel, Peer Review, Product Strategy, Target Market, Research Design, Data Analysis, Marketing Communications, Marketing Strategies, Research Reports",Beginner,3 - 6 Months
Meta Marketing Analytics,https://www.coursera.org/professional-certificates/facebook-marketing-analytics,Meta,4.7,"Data Storytelling, Business Metrics, Key Performance Indicators (KPIs), Marketing Analytics, Bayesian Statistics, Data Visualization, Descriptive Statistics, Marketing Effectiveness, Statistical Hypothesis Testing, Target Audience, Marketing Strategies, Data Cleansing, Pandas (Python Package), Data Modeling, Data Analysis, Data Visualization Software, A/B Testing, Data Collection, Marketing, Interviewing Skills",Beginner,3 - 6 Months
Think Outside the Inbox: Email Marketing,https://www.coursera.org/learn/think-outside-the-inbox,Google,4.8,"Email Marketing, Campaign Management, Copywriting, Marketing Strategy and Techniques, Personally Identifiable Information, Digital Marketing, Marketing Automation, Newsletters, HubSpot CRM, Marketing Analytics, Promotional Strategies, Data Ethics, Performance Analysis, A/B Testing, Customer Retention, Key Performance Indicators (KPIs)",Beginner,1 - 3 Months
AI for Marketing,https://www.coursera.org/specializations/aiformarketing,Emory University,4.6,"AI Personalization, Generative AI, Marketing Automation, Customer Retention, Personalized Service, Marketing Operations, Marketing Analytics, Data-Driven Decision-Making, Customer Analysis, Customer experience improvement, Customer Insights, Marketing Strategies, Marketing, Marketing Effectiveness, Content Marketing, MarTech, Customer Engagement, Business Marketing, Customer Acquisition Management, Artificial Intelligence",Beginner,3 - 6 Months
Generative AI for Digital Marketing,https://www.coursera.org/specializations/generative-ai-for-digital-marketing,IBM,4.7,"Prompt Engineering, ChatGPT, Generative AI, Digital Advertising, Email Marketing, OpenAI, Digital Marketing, Marketing Automation, AI Personalization, Marketing Analytics, Advertising Campaigns, Marketing, Marketing Strategies, Content Creation, Keyword Research, Large Language Modeling, Social Media Marketing, Artificial Intelligence, Search Engine Optimization, IBM Cloud",Beginner,1 - 3 Months
Viral Marketing and How to Craft Contagious Content,https://www.coursera.org/learn/wharton-contagious-viral-marketing,University of Pennsylvania,4.8,"Content Marketing, Social Media Strategy, Consumer Behaviour, Influencing, Marketing Communications, Social Media Marketing, Persuasive Communication, Social Media, Advertising, Brand Strategy, Marketing, Marketing Psychology, Storytelling",Mixed,1 - 4 Weeks
Business and Marketing Strategies,https://www.coursera.org/specializations/uol-business-and-marketing-strategies,University of London,4.5,"Operations Management, Process Design, Operational Excellence, Business Operations, Strategic Marketing, Manufacturing Operations, Marketing Strategy and Techniques, Operational Efficiency, Consumer Behaviour, Marketing, Marketing Effectiveness, Market Analysis, Business Ethics, Marketing Psychology, Social Sciences, International Relations, Culture, Business Management, Business, Marketing Analytics",Beginner,3 - 6 Months
Java Programming and Software Engineering Fundamentals,https://www.coursera.org/specializations/java-programming,Duke University,4.6,"Object Oriented Programming (OOP), Java, Java Programming, Hypertext Markup Language (HTML), Software Design, Software Design Patterns, Data Structures, HTML and CSS, Debugging, Software Engineering, Cryptography, Web Development, Programming Principles, Computer Programming, Encryption, AI Personalization, Javascript, Algorithms, Data Analysis, Cascading Style Sheets (CSS)",Beginner,3 - 6 Months
Core Java,https://www.coursera.org/specializations/core-java,LearnQuest,4.6,"Java Programming, Spring Framework, Java, Eclipse (Software), Object Oriented Programming (OOP), Object Oriented Design, Integrated Development Environments, Development Environment, Java Platform Enterprise Edition (J2EE), Software Design, Software Installation, Computer Programming, Programming Principles, Program Development, Virtual Machines, Web Development, Debugging, Package and Software Management, Data Structures, File Management",Intermediate,3 - 6 Months
Learn Java Programming,https://www.coursera.org/learn/learn-java-programming,Heriot-Watt University,,"Object Oriented Programming (OOP), Java, Java Programming, Computer Programming, Programming Principles, Software Development, Algorithms, Computational Logic",Beginner,1 - 4 Weeks
Introduction to Java,https://www.coursera.org/learn/java-introduction,LearnQuest,4.6,"Eclipse (Software), Java, Java Programming, Integrated Development Environments, Development Environment, Software Installation, Computer Programming, Programming Principles, Program Development, Object Oriented Programming (OOP)",Beginner,1 - 4 Weeks
Object Oriented Programming in Java,https://www.coursera.org/specializations/object-oriented-programming,Multiple educators,4.6,"Unit Testing, Data Structures, Event-Driven Programming, Interactive Data Visualization, Java, Java Programming, Development Testing, User Interface (UI), Object Oriented Programming (OOP), Debugging, Software Testing, Computer Programming, Cryptography, Software Engineering, Performance Tuning, Encryption, Algorithms, Data Analysis, Software Design, Problem Solving",Beginner,3 - 6 Months
Java FullStack Developer,https://www.coursera.org/specializations/java-fullstack,Board Infinity,4.4,"Angular, Web Applications, HTML and CSS, Web Development, Eclipse (Software), JavaScript Frameworks, Spring Boot, Object Oriented Programming (OOP), Restful API, Java Programming, Model View Controller, Object Oriented Design, Hypertext Markup Language (HTML), Front-End Web Development, Spring Framework, Java, Web Services, Integrated Development Environments, Cascading Style Sheets (CSS), Javascript",Intermediate,1 - 3 Months
Oracle Java Foundations,https://www.coursera.org/learn/oracle-java-foundations,Oracle,4.8,"Java, Object Oriented Programming (OOP), Oracle Cloud, Computer Programming, Cloud Development, Integrated Development Environments, Development Environment",Beginner,1 - 4 Weeks
Programming with Java,https://www.coursera.org/learn/programming-with-java,Amazon,4.2,"Object Oriented Programming (OOP), Object Oriented Design, Java, File Management, Data Import/Export, Maintainability, Debugging, Software Development",Beginner,1 - 4 Weeks
Java Programming: Solving Problems with Software,https://www.coursera.org/learn/java-programming,Duke University,4.6,"Debugging, Java, Algorithms, Java Programming, Statistical Analysis, Software Design, Computer Programming, Integrated Development Environments, Data Processing, Object Oriented Programming (OOP), Data Analysis, Software Testing, Problem Solving",Beginner,1 - 3 Months
Object Oriented Java Programming: Data Structures and Beyond,https://www.coursera.org/specializations/java-object-oriented,University of California San Diego,4.7,"Unit Testing, Growth Mindedness, Data Structures, Graph Theory, Event-Driven Programming, Interactive Data Visualization, Java, Java Programming, Network Analysis, Object Oriented Programming (OOP), Technical Communication, Development Testing, User Interface (UI), Software Testing, Computer Programming, Adaptability, Object Oriented Design, Performance Tuning, Algorithms, Problem Solving",Intermediate,3 - 6 Months
Fundamentals of Java Programming,https://www.coursera.org/learn/fundamentals-of-java-programming,Board Infinity,4.4,"Eclipse (Software), Object Oriented Programming (OOP), Java Programming, Object Oriented Design, Java, Integrated Development Environments, Development Environment, Computer Programming, Programming Principles, Algorithms, Virtual Machines",Beginner,1 - 4 Weeks
